episode,script,ners
184,"Rock away your existence,
 Shouting that you are here…
 A new journey begins now.
 As we survived through the changing seasons,
 we gained knowledge and strength, (just looks like a survival game)
 But the forgotten memories,
 of the feelings abandoned within the flows of time,
 have also been lost.
 When sinking down, we learned loneliness.
 But now we’ve met each other, we are no longer alone.
 Unveil your feelings, Those high emotions
 Those tears will change your fate.
 Pound your heartbeat against the darkness,
 We’re sure to meet, Under the same flag of pain
 What do you mean by monitoring Akamaru?
 You know about the incident
 where someone from outside infiltrated the village, right?
 Yeah, I know about that.
 But I heard that Kiba and the others resolved that incident without any trouble.
 That’s right.
 Damn! That Kiba!
 I want a mission where I totally kick an enemy’s butt.
 To be exact, that’s wrong.
 What?
 Before Kiba and the others had the intruder in custody…
 he swallowed a pellet and killed himself.
 What? Suicide…?
 In the investigation that followed,
 it was revealed that the enemy was a Shinobi
 from another land that uses a unique tactic.
 Perhaps he took his own life in order to seal that power.
 What’s the “unique” tactic?
 Something you would call a biological weapon.
 Biological weapon?
 It’s a particular pathogen…
 a terrible weapon where someone infected will gradually lose oneself
 and have their body taken over.
 But how is that connected with monitoring Akamaru?
 Could it be that Akamaru was…?!
 There’s a possibility he’s infected.
 He still doesn’t look so well.
 Y-Yeah…
 Since Akamaru’s not in his best condition,
 I’m skipping training today as well.
 Okay…
 Oh!
 Wh-What’re you doing, Shino?!
 Shino, do something quick!
 Shino!
 The insects suddenly stopped listening to me.
 Jeez, give me a break.
 I’m sorry.
 We’ll head back early for the time being. See ya.
 I hope… Akamaru gets better soon.
 Shino?
 It’s the first time the insects have attacked a comrade…
 What is it, Akamaru?
 Oh, shoot! I’ve been spotted!
 What’re you doing, Naruto?
 Wh-What, you ask?
 I’m developing a new Jutsu, believe it!
 So as for me, I’m busy and…
 Kiba's Long Day
 Is there no mistake, Sis?
 I’d say the possibility at this point is around fifty-fifty.
 I still haven’t been able to identify it,
 but these are the lab results of the blood drawn from Akamaru…
 But! It could be some kind of mistake!
 Do you think I, a veterinarian, would make such a mistake?
 Yeah… You’re right.
 What is it, Akamaru?!
 Let go! Let go!
 Akamaru, it’s Naruto. It’s okay to let go.
 Hey, Akamaru!
 Akamaru!
 What did you do that for Akamaru?
 I mean, what’re you doing in the front yard of my house?
 Huh? Well, that’s…
 Anyway, come in.
 For the time being, I have to fulfill my responsibility as the owner.
 What?
 What?!
 Geez! Biting a comrade of the same village can’t be allowed!
 Are you training him properly, Kiba?!
 All right.
 It’s finished! Perfect if I do say so myself!
 Sis! That looks just like a surgical scar!
 What? Really? I thought it turned out well, though…
 Sorry, Naruto.
 Have Sakura or someone patch them up for you!
 Hm? Right…
 See ya.
 Right.
 See you later too, Miss Hana!
 Akamaru…
 I’m telling you,
 there’s nothing else other than my pants getting all torn up.
 Shino’s insects attacked Akamaru…
 He even attacked Naruto, whom he should know very well.
 There’s trouble, Lady Tsunade!
 It seems they were attacked by someone
 in the middle of night training.
 Looks like they launched a sneak attack with quite a few men.
 No, it seems there was just one culprit.
 What?! All of this by one person?!
 To be precise, that’s not correct.
 It’s one animal.
 There’s no doubt.
 There’s trouble, Kiba!
 You’re talking about the incident
 where Shinobi were attacked during night training last night, right…?
 It-It can’t be!
 It seems it’s as you said, Sis…
 I can smell blood from Akamaru.
 That’s Kiba Inuzuka’s Ninja Hound Akamaru, correct?
 You jerks. What do you want with Akamaru?!
 A warrant…?
 Kiba…!
 Yes, there’s no mistake.
 Kiba Inuzuka, by order of the Hokage,
 the Ninja Hound Akamaru is to be kept
 under the supervision of the Anbu Black Ops.
 – Damn it! 					– Kiba!
 We should obey the Lady Hokage’s order.
 Damn it!
 Akamaru…
 Here.
 Thanks, Sis.
 This contains medicine that I prepared,
 so give it to the vet over there.
 Right. I’m off, then.
 Naruto…?
 What’s the idea of Akamaru being detained?!
 Akamaru is the culprit from last night’s incident.
 We have sufficient proof as well.
 At this point, it’s an unavoidable measure.
 The Medical Team is now desperately looking for a way to save Akamaru.
 Don’t worry too much.
 If…that doesn’t work either, what’ll happen to Akamaru?
 At that time…
 there’ll be nothing left to do but to put Akamaru down!
 Hidden Leaf Veterinary Hospital
 You don’t need to worry.
 The Medical Corps will figure something out soon.
 Right…
 Take care on your way home.
 Right.
 Akamaru…
 I won’t hand you over to anyone.
 It seems Kiba Inuzuka has taken Akamaru and fled.
 Lady Tsunade, what shall we do?
 In preparation for the worst,
 have the Special Pursuit Corps stand by here!
 The Special Pursuit Corps…
 C-Could it be that you’re really going to kill Akamaru…Grandma?
 Grandma Tsunade!
 It’s hard for me, too.
 Damn it!
 Did you find them?!
 No!
 Kiba!
 Kiba!
 He’s rapidly getting worse.
 Akamaru!
 Where are they?
 They should be around here.
 I swore to protect him, no matter what!
 I swore never I’d never let him go through that experience ever again…!
 The Special Pursuit Corps has assembled.
 Show the team in.
 Kiba!
 Where are you?!
 I guess I was able to hide my tracks somewhat…
 This is a serum for Akamaru that the Medical Corps whipped up.
 I can’t guarantee the level of effect.
 There’s maybe a fifty-percent chance of survival.
 There’s also a risk of side-effects
 that would cause Akamaru to go even more berserk.
 In the event that happens…
 It’s an unavoidable measure, but Akamaru must…
 Reporting!
 The Akamaru Pursuit Corps has lost the trail of Kiba and Akamaru.
 Lady Tsunade.
 That way?!
 Akamaru…
 Kiba!
 Wh-What’s that?
 It’s Akamaru…
 But…
 I won’t hand over Akamaru to anyone!
 What’re you doing?!
 Have you come to kill Akamaru?!
 No! I just came out of concern!
 You lie! The Lady Hokage said it, didn’t she?!
 There’ll be nothing else to do but to kill Akamaru.
 You came to dispose of Akamaru, right?!
 I won’t hand over Akamaru to anyone!
 This isn’t the time to be doing that!
 Something called the Special Pursuit Corps or whatever is coming after Akamaru!
 What?!
 The Pursuit Corps should be here soon.
 Akamaru will really be in trouble if that happens!
 You and I have to do something before that!
 This isn’t the time to be fighting!
 Shut up!
 Why don’t you get it, Kiba?!
 Shut up!
 All right! I’ve sighted Akamaru!
 Kiba, Naruto! You guys step back!
 C-Could it be…the Pursuit Corps is…
 Sis!
 You gotta be… joking, right?
 Sis!
 What’re you going to do to Akamaru with that?
 This is medicine I received from the Hokage.
 I’m going to inject it into Akamaru.
 Then Akamaru will be saved?!
 The probability is fifty-fifty.
 If it fails and side-effects are produced,
 Akamaru’s symptoms will get even worse.
 All we can do now is take a chance on this.
 If the worst happens and it fails…
 You understand, right, Kiba?
 Damn it…
 Even if it’s only fifty percent,
 there’s a possibility that Akamaru will be saved.
 We’ve gotta do this! I’ll also help out, miss!
 Shadow Clone Jutsu!
 Kiba, what about you?!
 If you’re not going to do anything, you’re in the way, so beat it!
 Let’s go, Kiba.
 Just leave that coward be.
 You’re ready, right? Let’s go, Naruto!
 We’ll save you now, Akamaru!
 Aim for the legs! lmmobilize Akamaru!
 Right!
 Since it’s come to this, I have no choice.
 I must terminate Akamaru.
 Stop!
 I said stop… Akamaru.
 Kiba!
 Kiba?
 Akamaru…
 Have you forgotten…my scent?
 We were always together from when we were little, weren’t we?
 Akamaru…
 Why…why…did you become like this?
 Please remember… Akamaru!
 Kiba!
 I'm sorry, Akamaru…
 I put you through nothing but painful experiences.
 I’m sorry, Akamaru… I couldn’t protect you…
 I’m sorry… Akamaru…
 I'm a terrible master.
 But…
 I’ll…always be with you.
 Kiba…
 Kiba!
 It really would’ve been touch and go
 if the Medical Corps had been even a little late in arriving.
 Without a doubt,
 he would’ve lost his life if Akamaru’s attack had hit Kiba’s vital spot…
 Really, it could have been much worse.
 That’s wrong…
 Huh? Kiba?!
 When he came at me with his final attack,
 Akamaru just barely missed my vital spots.
 He drained all his remaining strength in order to desperately control himself.
 Akamaru was battling desperately with himself.
 That’s admirable, Akamaru!
 Thanks…
 Akamaru.
 Yesterday’s Call Sign, was all from my cell phone.
 In a strange park, I play the Fuzz Guitar without enthusiasm.
 Yellow Moon.
 Even now, counting to three, I open my eyes
 Shadow Moon I am still dreaming.
 Look at my eyes, look at my eyes, as we face one another’s back
 Look at my eyes, when can we meet?
 EveryDay EveryNight With every word I can think of
 Right away, my messy feelings as is,
 A magical chord change, in a restless city
 A daily JAZZ Guitar played in a soft minor key
 In this world, there remain mysteries yet unsolved.
 We came to the Hidden Leaf Village in search of mystery
 and encountered a succession of hair-raising terror.
 However, we charge forward without being daunted
 by the forest that bares its fangs.
 And then at last…!
 We witness with our own eyes,
 the creature of the legend handed down from generation to generation.
 Next time: “A Legend from the Hidden Leaf: 		The Onbaa!
","[set(), set(), set(), set(), set(), {'Akamaru'}, set(), set(), {'Kiba'}, set(), set(), {'That'}, set(), set(), set(), {'Kiba'}, set(), set(), set(), set(), set(), set(), set(), set(), {'Akamaru'}, {'Akamaru'}, set(), set(), {'Akamaru'}, set(), {'Shino'}, {'Shino'}, {'Shino'}, set(), set(), set(), set(), set(), {'Akamaru'}, {'Shino'}, {'Akamaru'}, set(), set(), {'Naruto'}, set(), set(), {'Kiba'}, set(), set(), set(), set(), set(), {'Akamaru'}, set(), set(), {'Naruto', 'Akamaru'}, set(), {'Akamaru'}, {'Akamaru'}, {'Akamaru'}, set(), set(), set(), set(), set(), set(), set(), set(), {'Kiba'}, set(), set(), set(), set(), set(), set(), set(), {'Naruto'}, {'Sakura'}, set(), set(), set(), {'Hana'}, {'Akamaru'}, {'Naruto', 'Akamaru', 'Shino'}, {'Tsunade'}, set(), set(), set(), set(), set(), set(), set(), set(), {'Kiba'}, set(), set(), {'Akamaru', 'Sis'}, {'Kiba'}, set(), {'Akamaru'}, set(), {'Kiba'}, set(), {'Kiba'}, set(), {'–'}, {'Hokage'}, set(), {'Akamaru'}, set(), set(), set(), set(), {'Naruto'}, {'Akamaru'}, {'Akamaru'}, set(), set(), {'Akamaru'}, set(), {'Akamaru'}, {'Akamaru'}, set(), set(), set(), set(), {'Akamaru'}, {'Kiba', 'Akamaru'}, {'Tsunade'}, set(), {'Akamaru'}, {'Tsunade'}, set(), set(), set(), set(), {'Kiba'}, {'Kiba'}, set(), {'Akamaru'}, set(), set(), set(), set(), set(), set(), {'Kiba'}, set(), {'Akamaru'}, set(), set(), {'Akamaru'}, {'Akamaru'}, {'Kiba', 'Akamaru'}, {'Tsunade'}, set(), {'Kiba', 'Akamaru'}, set(), {'Akamaru'}, set(), {'Akamaru'}, set(), set(), set(), {'Hokage'}, {'Akamaru'}, {'Akamaru'}, {'Akamaru'}, set(), {'Akamaru'}, set(), set(), {'Akamaru'}, set(), set(), set(), {'Kiba'}, set(), set(), {'Akamaru'}, {'Naruto', 'Kiba'}, set(), set(), set(), set(), {'Akamaru'}, set(), {'Akamaru'}, {'Akamaru'}, set(), {'Akamaru'}, set(), {'Kiba'}, {'Akamaru'}, set(), set(), set(), {'Kiba'}, set(), {'Kiba'}, set(), set(), {'Naruto'}, {'Akamaru'}, set(), {'Akamaru'}, set(), set(), {'Akamaru'}, set(), {'Akamaru'}, {'Kiba'}, {'Kiba'}, {'Akamaru'}, set(), {'Akamaru'}, {'Akamaru'}, {'Kiba'}, {'Akamaru'}, {'Akamaru'}, set(), set(), set(), {'Kiba', 'Akamaru'}, set(), {'Kiba'}, {'Akamaru'}, set(), {'Akamaru'}, {'Akamaru'}, {'Akamaru'}, set(), set(), set(), {'Shadow'}, set(), set(), set(), set(), set(), set(), set()]"
27,"Press down hard on the gas
 That’s right, there’s no compromise
 We'll slip through the night
 At the final moment push hard
 That's right, all the way to zero,
 Until we wipe away the days
 Gently open your heart
 If you pull it close to you
 It will reach you, without a doubt
 It will come, closer
 Now
 We’re speeding through life, squeezing it for all of its worth
 Our feet are tied
 But we still keep going farther
 Even if I take it back, and grasp it
 If you’re not the one
 There will be no meaning
 And so we’ll go far off into the distance.
 I like your determination!
 Then…
 For those who are still here…
 The first test...
 you have passed it!
 You’ve passed through the gates!
 The first test for the Chunin Exams has been completed…
 I wish you well.
 All right! Wish us well!
 What a funny guy…
 Huh…
 I didn’t think that there would be a guy who would pass the first test
 with a blank test sheet.
 Naruto Uzumaki. He really is a funny guy.
 The Chunin Exam Stage 2: The Forest of Death!
 There’s something kind of creepy about this place.
 This place is called the Forest of Death, you’ll soon realize why.
 “The Forest of Death, you’ll soon realize why.”
 That kind of threat won’t work on me one bit!
 I’m not scared!
 Really?
 You’ve got a lot of energy.
 A kid like you dies at very beginning,
 dappled with the red blood I like.
 I’m returning your…Kunai Knife…
 Thank you for taking the trouble…
 But…don’t stand behind me, thirsty for blood.
 If you don’t want a quick death…
 Well, it’s my nature to act up at the sight of red blood.
 And my precious hair was cut, so I got excited…
 Naruto…
 I’m sorry…
 W-What with that Proctor?
 Frankly, she’s psycho!
 This one, too…
 That girl, why was her tongue so long?
 Evidently, we’ve got a lot of hot-blooded kids this time.
 This will be fun.
 You’re the most hot-blooded! Believe it!
 Well, before we start the second exam, I have to pass this out to you!
 It’s a consent form,
 before you can take part in the test you have to sign this.
 Why?
 From here on out, corpses are going to come out,
 I have to get your consent to that!
 Or it’ll be my responsibility.
 Well, I’m going to start the explanation for the second exam.
 In a word, the limits of your survival will be challenged.
 Survival, huh? This test is a total pain.
 First, I’ll give you step-by-step instruction on the terrain of this Training Field.
 Training Field Number 44 is surrounded by 44 locked entrance gates,
 there are rivers and a forest and a tower in the middle.
 It’s about 10 kilometers from the towers to the gate…
 In this confined area, you will go through a certain survival program.
 The contents of which are…
 anything goes scroll battle!
 Scroll…?
 Yes…
 I want you to fight for two scrolls, the Heaven Scroll and the Earth Scroll.
 All together 26 teams got through the first test.
 Half of them...
 13 teams get the Heaven scroll, the other half get the Earth Scroll.
 I’ll hand over one scroll to each team.
 To put it simply,  that’s what you’re vying for.
 And the conditions to pass?
 Three of you bring both the Heaven and Earth Scrolls to the tower in the center.
 That means that of the 13 teams, half of them will fail for sure…
 Except it has to be in time.
 For this second exam, the time limit is 120 hours.
 Do it in exactly five days!
 Five days.
 What do we do about food?
 Be self-sufficient! It’s a treasure trove in the wilderness.
 There’s more than enough for food…
 However…
 It’s teeming with fierce people-eating animals,
 poison bugs, poisonous weeds and much more.
 No way…
 Fool, that’s why it’s called survival!
 Besides, it’s improbable that 39 people, 13 teams will pass.
 The interval for activity gets longer with passing each day,
 while the time for recovery gets shorter…
 Seems pretty grueling!
 On top of that, you’re surrounded by nothing but enemies,
 even falling asleep will be a problem…
 And, besides those injured during attempts to capture scrolls…
 there will definitely be people
 are unable to endure the rigors of the course.
 Umm…so you can quit in the middle of it?
 According to the rules, you cannot give up in the middle of it!
 I want you to spend five days in the forest.
 Just like I thought…
 This is going to be a pain!
 Moving on, conditions of disqualification.
 Number 1, if all three members of the team can’t make it to the tower
 with the Heaven and Earth Scrolls within the time limit.
 Number 2, if a team loses a member or if a member became incapacitated.
 There’s that, and this is a supplement…
 Absolutely do not look at the contents of the scrolls
 until you have reached the tower!
 W-What happens if we look at it halfway through?
 When you look at it you’ll find…out!
 Huh?
 There are times when a Chunin must deal with super-secret text.
 This is to test your reliability.
 That’s all the explanation!
 I’ll exchange your three consent forms for the scrolls in that hut over there.
 After that, pick your entrance, and all the gates will open simultaneously!
 Finally, just a word of advice…
 Don’t die!
 I see, so you won’t know which scroll was given to each team…
 and you won’t know which of the three people is carrying the scroll.
 If what Ibiki said was right,
 there will be life or death struggles for information in this test.
 Everyone is an enemy!
 The resolve of everyone here is strong.
 That means that it might come to killing each other.
 It looks like they understand the meaning of the consent form a little bit…
 Heeey, look who’s here!
 It’s Billboard Brow, isn’t it?
 I thought you went home long ago, I never imagined you were still here.
 Ooooh? Look who’s here, the ugly Inopig.
 Starting now, it's five days of the survival test with Sasuke.
 There’s no reason to go home.
 – Ugly! 					– Billboard!
 – Ugly! Ugly! – Billboard! Billboard!
 – Ugly, ugly, ugly! – Billboard, billboard, billboard!
 – Billboard, billboard, billboard! – Ugly ugly ugly!
 – Ugly, ugly, ugly, ugly! – Billboard, billboard, billboard, billboard!
 Sakura, this is impossible for you.
 For your own sake, just hurry up and go home!
 I could say the exact same thing to you!
 Hey, why are those two on such bad terms?
 D-Do you think I care about something stupid like that?
 Man…all there is to do is write my name,
 why does it take this much time!
 Hey! Hinata! What are you doing over there?
 N-Naruto…
 Umm…uhhhh…well…
 Just like I thought, this kid is strange.
 A scratch…
 Uh-um… this…is--
 See ya!
 Naruto…
 It’s about time for the scroll exchange.
 Well, I wonder how many teams will survive…
 Teams who have taken the scroll,
 stay with the representative and move to the gate!
 We’ll all start simultaneously in 30 minutes!!
 Yeah! Survival is our forte!
 Hinata, don’t show your weakness.
 Uh, okay…
 Life or death…
 It’s a pain but we just have to do this.
 Since it’s come to this, Naruto will be our target.
 For snacks, there’s potato chips...
 – What about shortcake...? – I can’t believe you two!
 Okaaaay! I won’t lose!
 I’ll bring down whoever comes near me.
 – Yes! 					– Cha!
 Heh heh…finally the opportunity is here…
 We have the chance to fulfill our mission in earnest…
 Sure, the enemy teams are scary but,
 I’m really scared of spending five days with this guy.
 Target the rookies first.
 They said that from now on it’s okay to kill,
 which makes it easier.
 Master Guy, I’ll do my best! I’ll definitely succeed!
 We now start the second test of the Chunin Exam!
 Look for the brats!
 Those three, right?
 All right! Let’s go!
 Okay! First, we search for that thing.
 Can you do it, Hinata?
 Yes.
 Byakugan!
 Slow down, Lee! We just started.
 I know. But…
 I can’t stay still!
 Who knows what kind of powerful foe is waiting for us.
 Hot-blooded fool…
 As you already understand, we have only one target!
 W-What are you doing, Choji?
 Just a little break… I’m already tired, and hungry…
 What are you suddenly saying?!
 It hasn’t been five minutes since we started!
 But I can’t help it. I’m hungry…
 You! If you were able to bring snacks,
 you should have been able to bring one Kunai knife!
 Ino! Hide!
 Uh-oh!
 This kind of thing continuing  for five days…?
 Anyway, the tower is the goal for everyone, right?
 So it would be clever for us to make a trap in the vicinity of the tower.
 Okay…wasting no time, huh?
 Where are they?
 Heh…kids.
 It’s like begging to be found, standing in that conspicuous place.
 They sensed our presence,
 but, evidently they haven’t grasped where we are.
 What happened? 					You’re pale.
 W-What is that?!
 The Flying Leeches of Leaf Village sense body temperature and perspiration,
 then in mass, swoop down on their prey.
 If they continue to suck your blood for five minutes,
 you go to the other world…
 Using this behavior,
 we’d set a trap on the path enemies would use to escape.
 D-Darn it…
 That’s one team gone!
 It sounds like they’ve already started.
 Wasn't that someone screaming just now?
 I-I’m kinda getting nervous.
 I-It was nothing. Sakura. Believe it!
 I-I have to pee…
 Y-You…fool!
 What are you doing in front of a lady!
 Go to the grass!
 Aaah, that was a lot! I’m refreshed.
 Like I said, not in front of a lady--!
 S-Sasuke… no matter what, you don’t have to go that far.
 W-What was that for…?
 What are you doing…all of a sudden?!
 What you ask? That’s my line, isn’t it?
 Sasuke!
 It can’t be helped!
 Sasuke, please stop!
 Look closely at him!
 Talk! Where’s the real Naruto!
 I have no idea what you’re talking about!
 What happened to the scratch on you face?
 I’m asking what happened to the scratch you got before from the Proctor!
 And your Shuriken holster is on your left leg.
 That guy’s right handed!
 You’re worse at transformation than Naruto, you phony!
 Unlucky! You got me. ln that case…
 Which one of you got the scroll?
 If you listen to me obediently, I’ll spare your lives.
 I see! Then I’ll resort to force!
 Hey, can you hear it?
 The clear, blue sky goes on and on
 The ocean spans limitlessly
 Please keep that smile on your face forever
 Or else I’ll cry
 You won't have to search around you
 It’s all ok now.
 Everyone is inside this hand
 when you want to cry, and you want to run away
 When you forget what happiness is
 Just sing.
 Light is born, and darkness was born
 The two are one
 Harmonia, feel the telepathy
 Hey, can you hear it?
 Aww, stupid gas mask man!
 Suddenly sneaking up on someone when they're peeing!
 I messed up just a little bit.
 Now I have to hurry and meet up with Sakura.
 Wait a minute! What is this giant snake?
 Hey! Are you serious?! Wait a minute, hey!
 I've been gulped down!
 Next episode: ""Eat or Be Eaten: Panic in the Forest""
 Will I return to action?!
","[set(), set(), set(), set(), set(), set(), set(), set(), {'Naruto'}, set(), set(), set(), set(), set(), set(), set(), set(), set(), {'Kunai'}, set(), {'Naruto', 'Proctor'}, set(), set(), set(), set(), set(), set(), set(), set(), set(), set(), set(), set(), set(), set(), set(), set(), set(), set(), set(), set(), set(), set(), set(), set(), set(), set(), set(), set(), set(), set(), set(), set(), set(), set(), set(), set(), set(), set(), set(), set(), set(), set(), set(), set(), set(), set(), set(), set(), set(), set(), {'Chunin'}, set(), set(), set(), set(), set(), set(), {'Ibiki'}, set(), set(), set(), set(), set(), set(), set(), {'Inopig'}, {'Sasuke'}, set(), set(), set(), set(), set(), set(), set(), set(), set(), set(), set(), set(), set(), {'Sakura'}, set(), set(), set(), set(), set(), set(), {'Hinata'}, set(), set(), set(), {'Naruto'}, set(), set(), set(), set(), {'Hinata'}, set(), {'Naruto'}, set(), set(), set(), set(), set(), set(), set(), set(), set(), set(), {'Guy'}, set(), set(), set(), set(), set(), set(), set(), set(), {'Hinata'}, set(), {'Byakugan'}, {'Lee'}, set(), set(), set(), set(), set(), {'Choji'}, set(), set(), set(), set(), set(), {'Ino'}, set(), set(), set(), set(), set(), set(), set(), set(), set(), set(), set(), set(), set(), set(), set(), set(), set(), set(), set(), set(), {'Sakura'}, set(), set(), set(), set(), set(), set(), set(), {'Sasuke'}, set(), set(), set(), set(), {'Sasuke'}, set(), {'Sasuke'}, set(), set(), {'Naruto'}, set(), set(), {'Proctor'}, set(), set(), {'Naruto'}, set(), set(), set(), set(), set(), set(), set(), set(), set(), set(), set(), set(), set(), {'Sakura'}, set(), set(), set(), set(), set(), set(), set(), set()]"
