episode,script,ners
32,"Press down hard on the gas
 That’s right, there’s no compromise
 We'll slip through the night
 At the final moment push hard
 That's right, all the way to zero,
 Until we wipe away the days
 Gently open your heart
 If you pull it close to you
 It will reach you, without a doubt
 It will come, closer
 Now
 We’re speeding through life, squeezing it for all of its worth
 Our feet are tied
 But we still keep going farther
 Even if I take it back, and grasp it
 If you’re not the one
 There will be no meaning
 And so we’ll go far off into the distance.
 I’ll show you there are walls
 which effort alone can never break through.
 Sakura Blossoms!
 Huh?!
 Your Jutsu is indeed fast.
 But our Jutsu exceeds that and is the speed of sound!
 Lee!
 My left ear...
 There’s a little gimmick I have.
 Evading won’t work... on my attacks.
 What is he going to do?!
 It’s sound.
 Even though you evaded my fist, sound assaulted you.
 Sound?
 Do you know what sound is all about in the first place?
 Vibration?
 Correct. In other words, hearing sounds means,
 that the eardrum is catching vibrating air.
 And the human eardrum breaks with sounds over 150 Mhz.
 Also, by assaulting the semicircular canal which is located even deeper,
 I can make you totally lose balance.
 You won’t be able to move your body freely for sometime.
 Something old and tired like Taijutsu don’t work on us.
 Well, you were doing good up to a certain point,
 but I brought forth my Jutsu.
 It’s just not gonna work anymore.
 I freely manipulate ultrasonic waves and air pressure,
 and have the power to obliterate even boulders!
 Primary Lotus!
 I can send air into the ground
 and change the dirt into a cushion as I please.
 It’s different from your silly Jutsu.
 Blast it!
 Lee, it is all right to use this Jutsu
 to protect someone precious.
 Protect... someone precious?
 In any case,
 I’m impressed that you were able to master it, little man!
 You did it quite well, Lee!
 Darn it!
 Okay, then!
 Next is...
 You!
 Darn it!
 He’s coming!
 What?!
 No way!
 Lee!
 Leaf...
 Hurricane!
 It looks like my earlier attack is having an effect!
 I’m somewhat surprised...
 but there’s not even a trace of that flash of combo Taijutsu you showed!
 This arm amplifies sounds from within to its maximum.
 It’s a speaker of sorts!
 Lee!
 And the assault sound isn’t limited by the direction of my arm...
 it always converges on the targeted prey by my Chakra!
 Lee!
 Now then... 					The final blow.
 I won’t let you!
 Oh, well.
 Hey, let’s get outta here!
 Those guys are pretty dangerous!
 It looks like Sasuke and Naruto are only unconscious, but...
 even that guy Lee’s been messed up and Sakura’s alone.
 What’re you gonna do, Ino?
 What do you mean?
 Well, Sakura’s in deep trouble!
 You’re all right with that?
 Huh?!
 You two were once close friends, weren’t you?
 By the way...
 What Sakura, don’t be so stiff!
 Well...
 Ino, I hear you also...
 What is it?
 ...like Sasuke.
 Then, that means from now on,
 you and I are rivals.
 Why... why am I recalling things from that time?
 Hey, Ino!
 What’re you gonna do?!
 I know, but there’s nothing I can do!
 I can’t heedlessly go out there, can I?!
 Even if I went out now...
 I’d be taken down without a doubt.
 I also...
 I also...!
 Air pressure! The shurikens got bounced back?!
 Your hair’s shinier than mine.
 Hey! If you have time to worry about your hair,
 you should practice!
 Getting all spiced up like a woman...
 Why don’t you kill that Sasuke guy right in front of this sexy bug, Zaku?
 Yeah! That sounds great!
 Hey hey...
 I won’t let you do such a thing!
 Don’t move!
 Sakura.
 My body... It has no strength.
 I...
 Again... I’m just pulling everyone’s feet!
 I’m always being protected.
 It's so frustrating!
 This time for sure... I had thought!
 This time for sure...
 I must protect people precious to me... so I thought!
 So...
 Let’s do this!
 Hey! Sasuke and Naruto are gonna get it, too!
 W-What should I do?!
 That’s pointless!
 That won’t work on me!
 What are you saying?
 Huh?
 What?!
 I always...
 act as if I’m a full-fledged Ninja.
 I always say that I like Sasuke.
 I always act like I know everything and lecture Naruto.
 I always just... watch them from behind.
 And yet...
 Tazuna, get back!
 Get back!
 Now then...
 Let’s get wild!
 This is the only way to take him down!
 Sasuke!
 Here it is!
 Those two always covered my back and fought for me.
 Lee, you say that you like me...
 I’ll protect you until I die!
 Primary Lotus!
 With me at your back...
 you risked your life and fought for me.
 I have a feeling that you taught me...
 Sakura!
 Sakura!
 Humph!
 I want to be like all of you!
 This time...
 I want all of you...
 to watch me...
 ...from behind!
 Sakura?
 Sakura...
 Kin! Kill her!
 Huh! That sign...
 Substitution Jutsu!
 On the right, huh? You think I’m a fool?
 With such a simple and basic Ninjutsu...
 you think you can come at me?!
 Kin, get out of the way!
 Useless!
 Air pressure 100 percent, ultrasonic waves 0%, output...
 Is that all you can do?
 Slicing Sound Wave!
 You’re easy to spot...
 You’re above!
 I’ve said it two or three times that that won’t work!
 This is enough... for you!
 Where next?
 Huh?!
 What...?!
 This time... it’s not a substitution!
 Get off me! Hey!
 Sakura...
 You’re always being called “Billboard Brow” and being picked on.
 Who’re you?
 I’m called Ino Yamanaka. How ‘bout you?
 I’m... Sakura.
 Huh? I can’t hear you. Say it louder.
 Sakura Haruno!
 Huh, I see.
 You have a wide forehead.
 So, Billboard Brow, huh...?
 That’s why you hide your forehead with your bangs.
 Like a ghost...
 Sakura, was it?
 Uh-huh...
 Come back here tomorrow.
 I’ll give you something nice.
 Huh?
 Darn, let go!
 See! You look cuter like this, Sakura!
 I’ll give you that ribbon.
 T-Thanks.
 But...
 But what?
 My forehead...
 You hide it, so people make more fun of you, you know?!
 You have a cute face Sakura, so you should be more confident!
 More confident!
 Ino...
 Hey, who’s that? Who’s she, Ino?
 Her name’s Sakura.
 Hey, say hello!
 Hello...
 Listen everybody! Listen!
 There’s someone I like! Who do you think it is?
 Hurry up and tell us!
 Don’t say it’s Sasuke?
 Huh? Why’d you know?
 What’re you talking about?
 Sasuke’s really popular, he’s the most popular!
 Huh? Is that so?
 Oh no! I’ll have a lot of rivals. What should I do?!
 Hey, Ino! Sakura’s been upbeat lately!
 She’s just acting brave and romping around!
 Ino! I’ve heard Sasuke likes girls with long hair.
 ...likes girls with long hair. ...likes girls with long hair.
 Sakura...
 I’ve heard you like Sasuke, too, Ino.
 From now on, we’re rivals.
 Your hair. It’s grown quite a bit.
 Ino...
 Why...
 Why are you on the same team as Sasuke?!
 I will not lose anymore... to you, Ino!
 Me too! I won’t lose to you, Sakura. No matter what!
 ...Sakura!
 I will...
 I will...
 Give it up!
 It’s really bad...
 Hey, Ino...!
 I must... protect everyone!
 You punk!
 Huh?
 Huh! More strange ones.
 Ino...?
 Sakura! I promised I wouldn’t lose to you, didn’t I?!
 Hey, can you hear it?
 The clear, blue sky goes on and on
 The ocean spans limitlessly
 Please keep that smile on your face forever
 Or else I’ll cry
 You won't have to search around you
 It’s all ok now.
 Everyone is inside this hand
 when you want to cry, and you want to run away
 When you forget what happiness is
 Just sing.
 Light is born, and darkness was born
 The two are one
 Harmonia, feel the telepathy
 Hey, can you hear it?
 Wow! This is Ino team’s battle?!
 What a formation based on calculations!
 I hate to admit it, but they’re strong!
 Even the Sound Village ones would be no match for them!
 We’ll protect Sasuke...
 Huh?! What’s this feeling?
 Next episode: ""Battle Formation: lno-Shika-Cho!""
 What in the world is going on?!
","[set(), set(), set(), set(), set(), set(), {'Lee'}, set(), set(), set(), set(), set(), set(), set(), set(), set(), set(), set(), set(), set(), set(), set(), set(), set(), set(), set(), set(), set(), {'Lee'}, set(), set(), {'Lee'}, set(), set(), set(), set(), set(), set(), set(), {'Lee'}, set(), set(), set(), set(), set(), {'Lee'}, set(), {'Lee'}, set(), set(), set(), set(), set(), set(), {'Naruto', 'Sasuke', 'Sakura', 'Lee'}, {'Ino'}, set(), {'Sakura'}, set(), set(), set(), {'Sakura'}, {'Ino'}, {'Sasuke'}, set(), set(), {'Ino'}, set(), set(), set(), set(), set(), set(), set(), set(), set(), set(), set(), {'Sasuke', 'Zaku'}, set(), set(), set(), set(), set(), {'Sakura'}, set(), set(), set(), set(), set(), set(), set(), set(), set(), set(), set(), {'Naruto', 'Sasuke'}, set(), set(), set(), set(), set(), set(), set(), {'Sasuke'}, {'Naruto'}, set(), {'Tazuna'}, set(), set(), set(), {'Sasuke'}, set(), set(), {'Lee'}, set(), set(), {'Sakura'}, {'Sakura'}, {'Humph'}, set(), set(), set(), {'Sakura'}, {'Sakura'}, set(), set(), set(), set(), set(), set(), set(), set(), set(), set(), set(), set(), set(), set(), set(), set(), set(), set(), set(), set(), {'Sakura'}, set(), {'Ino'}, set(), {'Sakura'}, set(), set(), set(), {'Sakura'}, set(), set(), {'Brow'}, set(), {'Sakura'}, set(), set(), set(), set(), set(), {'Sakura'}, set(), set(), set(), set(), set(), {'Sakura'}, set(), {'Ino'}, {'Ino'}, {'Sakura'}, set(), set(), set(), set(), set(), set(), set(), {'Sasuke'}, set(), set(), set(), {'Sasuke'}, set(), set(), set(), set(), set(), {'Ino'}, {'Sakura'}, set(), {'Ino'}, {'Sasuke'}, set(), set(), {'Sasuke', 'Sakura', 'Ino'}, set(), set(), set(), {'Ino', 'Sasuke'}, {'Ino'}, set(), {'Sakura'}, set(), {'Sakura'}, set(), set(), {'Ino'}, set(), set(), set(), set(), set(), set(), {'Sakura'}, set(), set(), set(), set(), set(), set(), {'Ino'}, set(), set(), set(), {'Sasuke'}, set(), set(), set(), set(), set()]"
185,"Rock away your existence,
 Shouting that you are here…
 A new journey begins now.
 As we survived through the changing seasons,
 we gained knowledge and strength, (just looks like a survival game)
 But the forgotten memories,
 of the feelings abandoned within the flows of time,
 have also been lost.
 When sinking down, we learned loneliness.
 But now we’ve met each other, we are no longer alone.
 Unveil your feelings, Those high emotions
 Those tears will change your fate.
 Pound your heartbeat against the darkness,
 We’re sure to meet, Under the same flag of pain
 Oh!
 Sorry, sorry.
 Was that some eagle poop just now?
 Nothing there, huh?
 Well, I worked up a sweat,
 so I guess I’ll go home and take a shower.
 A Legend from the Hidden Leaf: The Onbaa!
 I worked up a good sweat today too.
 What’s the deal, Akamaru?
 He says you smell bad, Naruto.
 Are you making sure to take a bath?
 Don’t be saying rude things!
 No, you seriously stink.
 Come to think of it…
 The poop from the eagle a moment ago might…
 Sakura.
 Oh, I found a slacker who can’t get a mission!
 That’s just… I’m not that much a slacker!
 So it seems. You must’ve done some reckless training.
 It’s ripped.
 Huh? You’re right. I didn’t notice!
 It can’t be helped.
 Bring it to me later. I’ll sew it up for you.
 Really?! Really?! Really?!
 Sakura, you’re such a nice person.
 It’s the first time in my life… you’ve been this nice to me!
 H-Hey, Naruto. You’re exaggerating.
 Naruto!
 Wh-What’re you doing, Sakura?!
 You touched my breast just now, didn’t you?!
 I didn’t do anything like that!
 Then, what’re those hairy hands sticking out from your armpit?!
 What’s…that?
 Huh? Huh?!
 Wh-What’s this?!
 Your back.
 Huh?
 Wh-What in the world is this?!
 It’s a huge poop!
 Idiot! That’s some kind of creature!
 Is it a caterpillar?!
 What?! Get it off.
 No, this is an animal.
 Let go!
 Give me a break.
 You guys, have you ever heard of the legend of Onbaa?
 Onbaa?
 I’ve never heard of it!
 Shizune! You don’t know?
 Nope. Is that legend something like an old tale or something?
 That’s what I thought, but…
 Long ago when I was young, I heard about a legend…
 A legend about a dangerous, hairy, bear-like creature called Onbaa
 who lived deep in the mountains near the village…
 One day, that idiot Jiraiya eagerly went into the forest
 saying he was going to investigate the Onbaa
 for his summer vacation independent research.
 The Pervy Sage?
 Yes…
 Are you an idiot?
 Do you seriously think there’s an Onbaa?
 Well, you’ll get yours when you see my independent research!
 Who would?
 Even if there were an Onbaa, it wouldn’t deal with you…
 You said it! Flat-chested girl!
 Who’s flat-chested?!
 No way is there such a thing as an Onbaa!
 You wanna bet on that?
 Yeah! I’ll bet!
 Then, I’ll bet on Jiraiya.
 Huh?!
 Then, I’m off to wrestle with an Onbaa!
 And? Did the Pervy Sage meet an Onbaa?
 When he came back three days later,
 he said he won with a force-out move…
 which most likely was a lie.
 Oh! here it is.
 Huh? What’s this?
 What lousy writing!
 You’re one to talk, Naruto.
 Let’s see… The Onbaa is big. lt is nine-feet tall.
 The Onbaa is scary.
 No one is a match for it when it gets mad.
 But I beat it at wrestling.
 What’s this?
 The Onbaa’s child likes being carried piggyback.
 They grow up on the parent’s back.
 What?!
 What Jiraiya wrote is bogus, tracing the legend as is, but…
 So there was an Onbaa…
 Grandma Tsunade, as for this thing,
 it stays piggyback on my back and won’t get off.
 What should I do?
 According to legend, the child Onbaa considers
 the first thing it sees after birth as its parent
 and clings to the back of that person.
 It seems they grow that way, piggybacked on the parent,
 until they become an adult.
 It seems until then, they never leave the parent’s back.
 Then, there’s no other way but to wait until it grows up.
 You say that, but when it grows up…
 it’ll turn into a scary nine-foot tall monster, right?
 What’s up with that straightforward reaction?
 Well, it’s a legend, so it’ll probably get off eventually…
 Don’t be so irresponsible!
 H-Hang in there, Naruto…
 We’ll be cheering you on from behind the scenes.
 Come up close rather than behind the scene, damn it!
 What is it?
 I won’t lose, you know!
 This isn’t a weight, man!
 What is it, Hinata?
 Naruto… I heard a strange rumor.
 A strange rumor…you say?
 That you…umm…had a child.
 Oh. You mean this?
 Huh?! Hinata!
 Hey! You okay?! Hinata!
 Hinata, Hinata!
 Hinata?!
 What’s the deal? You’re sure an extravagant guy…
 Oh!
 Am I going to have to take a bath every time he pees on me?
 Ichiraku Ramen
 You know, we don’t allow pets.
 The Leaf Village public health department is strict, you see.
 I missed dinner because of him.
 Overlook it just for today.
 But now that I look closer, he’s cute, isn’t he?
 So, what’s his name?
 He’s saying it himself, so I guess Onbu is okay.
 Onbu, huh…?
 Doesn’t he want to eat some Naruto fish cake?
 Here.
 Old man! Give me a whole roll of Naruto!
 Coming right up!
 Ever since you clung to my back,
 I’ve been getting nothing but odd jobs like this.
 Well, I guess it can’t be helped…
 He’s gotten big…! And so quickly…
 This is bad!
 Naruto Uzumaki, you are assigned a mission
 for the removal of the mountain bandits from Yamabuki Pass!
 Removal? Hey old lady…
 Onbu’s gotten big,
 so you intend to get rid of the troublemaker, right?
 N-No, it’s not like that.
 I was thinking you’ve had some eye-opening growth recently, so.
 Then, what about the other members?
 No…
 Since you’ve shown such remarkable growth,
 a solo infiltration should be fine.
 Sure enough, it’s getting rid of the troublemaker!
 This is also fate… Okay now, back to work.
 Thanks, mister!
 N-Naruto, Naruto.
 Things are fun when you’re around, Onbu!
 That Grandma Tsunade.
 Don’t think you were able to get rid of the troublemaker so easily.
 I’ll beat the mountain bandits and finish up this mission lickety-split
 and the two of us will return to the Leaf Village with pride!
 Right, Onbu?!
 Hey! Mountain bandits! Come out!
 Who’re you, creep?!
 Who’re you?!
 What do you want?!
 I’m Naruto Uzumaki with my kid Onbu!
 Prepare yourselves!
 – Say what?! 					– Get him!
 Shadow Clone Jutsu! 184.01	02:29:44:16	02:29:45:10	Onbu!
 Even knowing it’s a clone…
 I won’t forgive those who hurt Onbu!
 Heh! How was that?!
 Die!
 Onbu! You saved me!
 Onbu… I owe you my life.
 Let’s get back to the village quick and surprise everyone!
 Onbu! No way will I believe that you’re a dangerous creature!
 We’ll go as the Onbu-Naruto team succeeding the Kiba-Akamaru team!
 What was that?
 It’s okay…
 You’ve got me with you.
 Onbu?! No, it’s huge!
 Could it be…you’re after Onbu?
 Are you Onbu’s mom?!
 W-W-W-Wait! I didn’t steal him!
 Onbu! Say something, will you?!
 Y-You idiot, Onbu!
 No, y- you’ve got the wrong idea!
 Onbu, it’s your mom.
 It’s not my intention!
 Damn it! I had a rough time of it.
 If you're a mother,
 then take better care of your child, really!
 It’s okay! I’ll return Onbu to you! So rest easy.
 Huh? My body got light.
 Huh? Onbu? You got so big!
 Huh, wha--? What’s the matter, Onbu?!
 What’s the deal?!
 W-W-W-Wait… Onbu, it’s me! Can’t you tell?!
 We were getting along so well just a moment ago!
 Please remember me!
 It’s me! Naruto U-zu-ma-ki!
 Oh, yeah! Naruto!
 Naruto! Naruto!
 Onbu, look at this!
 Remember! Remember this spiral!
 Naruto, Naruto!
 You remember my back you clung to the whole time, don’t you?
 Have I…had it?
 Onbu…
 I’m tired…
 This feels kind of good…
 It’s like I’m being carried piggyback.
 Onbu…
 Onbu!
 Live in good health with your mom.
 All right!
 My sides…are splitting!
 Onbaa is now no longer a legend.
 They’re thriving in the village forest and seriously proliferating.
 The stupid eagles carried them in, so.
 Naruto! How’d you tear it off you?! Tell me!
 Who knows? All I did was wrestle with Onbu.
 Don’t be so mean!
 At this rate, the village will be crushed.
 Tell me! Naruto!
 Don’t look at me.
 Yesterday’s Call Sign, was all from my cell phone.
 In a strange park, I play the Fuzz Guitar without enthusiasm.
 Yellow Moon.
 Even now, counting to three, I open my eyes
 Shadow Moon I am still dreaming.
 Look at my eyes, look at my eyes, as we face one another’s back
 Look at my eyes, when can we meet?
 EveryDay EveryNight With every word I can think of
 Right away, my messy feelings as is,
 A magical chord change, in a restless city
 A daily JAZZ Guitar played in a soft minor key
 Shino and I have been sent to a certain village to deal with
 a dispute over a family head who passed away.
 An old woman suddenly appears on the road and says this to us.
 “Even dead men laugh in Motoyoshi Village.”
 They were mysterious words. I never imagined it at this time.
 To think I would see with my own eyes,
 a sight in this village too frightening to even talk about…
 Next: “Laughing Shino.”
 I can’t even go to the bathroom alone at night.
","[set(), set(), set(), set(), set(), set(), set(), set(), set(), set(), set(), set(), {'Akamaru'}, {'Naruto'}, set(), set(), set(), set(), set(), set(), set(), set(), set(), set(), set(), set(), set(), set(), set(), set(), set(), set(), {'Sakura'}, set(), {'Naruto'}, set(), {'Naruto'}, {'Sakura'}, set(), set(), set(), set(), set(), set(), set(), set(), set(), set(), set(), set(), set(), set(), set(), set(), set(), set(), set(), {'Onbaa'}, {'Onbaa'}, set(), set(), set(), set(), set(), {'Onbaa', 'Jiraiya'}, {'The'}, set(), set(), set(), set(), set(), set(), set(), set(), set(), set(), set(), {'Jiraiya'}, set(), set(), set(), {'Onbaa', 'the'}, set(), set(), set(), set(), set(), set(), {'Naruto'}, set(), set(), set(), set(), set(), set(), {'Onbaa'}, set(), set(), {'Onbaa', 'Jiraiya'}, set(), {'Onbaa'}, set(), set(), set(), set(), set(), set(), {'Naruto'}, set(), set(), set(), set(), {'Hinata'}, {'Naruto'}, set(), set(), set(), set(), set(), {'Hinata'}, set(), set(), {'Hinata'}, {'Hinata'}, {'Hinata'}, set(), set(), set(), {'Ichiraku'}, set(), set(), set(), set(), set(), set(), set(), {'Naruto'}, set(), set(), set(), set(), set(), set(), set(), {'Naruto'}, set(), {'Onbu'}, set(), set(), set(), set(), set(), set(), set(), {'Naruto'}, {'Onbu'}, {'Tsunade'}, set(), set(), {'Onbu'}, set(), set(), set(), set(), set(), set(), {'Naruto', 'Onbu'}, set(), set(), set(), set(), set(), {'Onbu'}, set(), set(), set(), set(), set(), set(), set(), set(), set(), set(), set(), set(), set(), set(), {'Onbu'}, {'Onbu'}, set(), set(), set(), set(), {'Onbu'}, set(), {'Onbu'}, set(), set(), set(), set(), set(), {'Onbu'}, set(), set(), set(), set(), set(), set(), set(), {'Onbu'}, set(), {'Onbu'}, set(), set(), set(), set(), {'Naruto'}, set(), {'Naruto'}, {'Naruto'}, {'Naruto'}, set(), set(), set(), {'Naruto'}, set(), set(), set(), set(), set(), set(), set(), {'Onbaa'}, set(), set(), {'Naruto'}, set(), set(), set(), {'Onbu'}, set(), set(), set(), {'Naruto'}, set(), set(), set(), set(), {'Shadow'}, set(), {'Shino'}, set(), set(), set(), set()]"
