episode,script,ners
191,"Rock away your existence,
 Shouting that you are here…
 A new journey begins now.
 As we survived through the changing seasons,
 we gained knowledge and strength, (just looks like a survival game)
 But the forgotten memories,
 of the feelings abandoned within the flows of time,
 have also been lost.
 When sinking down, we learned loneliness.
 But now we’ve met each other, we are no longer alone.
 Unveil your feelings, Those high emotions
 Those tears will change your fate.
 Pound your heartbeat against the darkness,
 We’re sure to meet, Under the same flag of pain
 I won’t count on you.
 I will go by myself.
 Wait. 					I 'll go too.
 I promised Hinata that I would definitely protect you, Princess!
 With Hinata…?
 She fought with the second Janin and got hurt badly…
 Hinata did…?
 You guys said that you didn’t accept the mission of protecting me.
 Then why do you concern yourselves with me…?
 I…
 Not only me, but Hinata and Choji, too.
 We don't like it when somebody before us is hurt or sad… That's all.
 Well, let’s go!
 If we pass through the valley ahead of us,
 we’ll get to the town.
 If we do that,
 they probably won’t chase us all the way there!
 Forecast: Death! Cloudy with Chance of Sun!
 Too bad, but you guys won’t be able to reach that village.
 Since you guys are going to die here!
 Wh-Why is he floating in the air?
 Hey kid, I bet a low-class Ninja like you can’t even imagine my Jutsu.
 Take this!
 Naruto!
 I’m okay.
 But what just flew at me?
 Don’t waste your time fighting me.
 I have already captured all three of your friends.
 What?
 Just hand over the girl.
 If you do that I’ll spare your friends.
 Choji and Hinata…
 So, what are you going to do kid?
 Naruto… Are you going to abandon me too?
 Oh no, this princess is telling you to save her,
 and let your friends die.
 Well, I don’t mind that kind of thinking since it’s the same as mine.
 Same as yours?
 That’s right.
 If someone is useful,
 then you should make use of them
 even though they may be your siblings.
 There is one thing I need to thank you guys for.
 Thank us? 					For what?!
 For doing in Ruiga and Jiga.
 I was going to put an end to them myself sooner or later anyways.
 What…?!
 It was clear that they would soon tell me,
 “Big Brother, give us the property and the money too.”
 Three feudal lords are not necessary in one country.
 And you still call yourselves brothers?!
 It doesn’t matter.
 Even though it’s my parents or my brothers.
 I'll make use of anything I can.
 Now, give her to me.
 I refuse.
 I see.
 Naruto…
 A person who would abandon his siblings
 would never keep his promise with me.
 Well, that’s true.
 It’s impossible, Naruto!
 You don’t even know what kind of Jutsu it is!
 That doesn’t matter!
 Shadow Clone Jutsu!
 Take this!
 What is this guy?
 There’s something hard around his body that I can’t see…
 Naruto!
 I'm sorry, but none of your Ninjutsu work on me.
 Not even one.
 Damn it!
 What?!
 What is that?
 Crystallized ice…?
 I can gather water vapor in the air
 and instantly turn it into crystallized ice.
 So the things that just attacked me were ice Shuriken.
 Man! It’s hard to see if it’s transparent ice.
 Just that is not too interesting.
 What is this great sense of danger?
 I’m sure his Jutsu has already started!
 Where is it, where is it coming from?!
 Kid, do you know today's weather forecast?
 Weather forecast?
 Cloudy and partly sunny.
 It’s a good weather for you to die.
 What is this?
 What?!
 Look out!
 Damn it!
 Naruto!
 That’s a lens!
 Lens?!
 Yup, I turned the crystallized ice into lens
 to gather the sunlight and shoot it.
 So, I can’t really control it, but it’ll be an instant when you die.
 As soon as the battle condition at the Land of Green is prepared,
 I’ll burn up the surrounding countries with this Jutsu.
 This way!
 It’s no use.
 I could even see things that are a thousand miles away.
 I found you.
 Naruto… Why do you protect me?
 I wonder why…
 I don’t know either.
 Naruto…
 Haruna!
 While I distract him, run!
 Don’t even think you guys could get away from my Jutsu
 by doing that!
 You decided to hand me over the princess?
 Who would hand over Haruna to the likes of you!
 What a fool.
 I’m telling you that if you hand me the selfish princess
 and just go back to the village, I’ll let your friends go.
 I promised with Hinata that I will save Haruna!
 Just to keep a promise with your friend,
 you’re gonna risk your life to fight in a hopeless battle, huh…?
 You’re just like the feudal lord in Land of Green.
 A good-natured big fool!
 Same as my father…?!
 You’re just like the feudal lord in Land of Green.
 A good-natured big fool!
 Same as my father…?!
 This is what the feudal lord foolishly said
 to us who were trying to take over the Land of Green:
 “Please do not torment the people in this country.”
 I beg you!
 I don’t care what happens to me,
 but please promise me one thing!
 This is a small weak country surrounded by big countries.
 Without the powers of the people, the country cannot prosper!
 In order for the country to prosper,
 we must take care of each individual people
 and not sacrifice a single life!
 I want you to consider the people as a family
 and not torment them.
 I am the feudal lord!
 It doesn’t matter what I do to the people, right?
 That’s why…
 That's why this country has been at peace until now!
 Peace doesn’t matter to me.
 All I need to do is use the people as the stepping stones
 and feather my nest!
 And because of that kind of good nature,
 his daughter was taken as a hostage!
 What do you mean?!
 It seems like it was ten years ago.
 A lot of the people were sacrificed by the pressure of the big country…
 Riots occurred in the country and the country came close to corruption.
 It was a bitter decision…
 I had no choice but to let my daughter,
 who is more important than my life, taken as a hostage.
 I know that Haruna will not forgive me…
 A cold-hearted father who sacrificed his own daughter
 just for the peace of the country.
 Why don’t you ask your daughter directly?!
 In the after life!
 My father was…killed!
 What an outrageously good-natured person, huh?
 You’re wrong, he was a great feudal lord!
 Naruto…
 Listen!
 There are two kinds of human beings in this world.
 Those who use others, and those who get used!
 In my case, I will get to the top using anyone,
 whether it’s my parents or my friends.
 You! I’ll never forgive you!
 Shut up!
 D-Damn…!
 Die!
 Naruto…
 You can’t move anymore?!
 You’re not the one…
 It was because of Haruna’s father that this country was peaceful…
 The person who is going to succeed this country is…
 The person is…
 Haruna!
 Stop!
 Stupid!
 Why aren’t you running away?!
 Kill me! If you kill me, your goal will be fulfilled, right?!
 Naruto, Naruto has nothing to do with this!
 So both the parent and daughter are naïve, after all.
 Why not complain to your father in the afterlife
 for making you sacrifice your life for the country?
 How scary…
 Y-You!
 It’s time for you to die, kid.
 I’m not a kid!
 My name is Naruto Uzumaki.
 I’m not going to hand over the Land of Green
 to a person like you!
 Naruto!
 Die!
 What?!
 No…way…
 But kid, it’s too late even though you took me down…
 The Land of Green without a feudal lord will collapse
 due to the war between the large countries over its territory.
 It’s too bad, but that’s not gonna happen!
 Shizune!
 It’s a pain, but we came to get you guys!
 Shikamaru!
 But…I didn’t ask you guys to come get us!
 But you look pretty beaten up.
 No no, this is…
 Naruto!
 Choji! Hinata! Yurinojou!
 Everyone was safe!
 Yeah.
 We were rescued by the people of Leaf Village.
 Huh? Oh yeah, why are you guys here?
 We received notice of a coup in the Land of Green
 and Lady Tsunade herself ordered me to come…
 Princess Haruna’s father was very kind to Lady Tsunade and me.
 My father…?
 Please forgive us, when we arrived, your father was already…
 I see…I’ve caused so much trouble for you.
 Damn!
 The position of the feudal lord that I finally got a hold of…
 But, then the surrounding countries are not going to stay quiet.
 It’s okay.
 An announcement has been sent out to the neighboring countries
 in the name of the next feudal lord.
 Under your name, Princess Haruna.
 Then we don’t need to worry about the country getting attacked anymore!
 Haruna!
 Haruna…
 Do it.
 You want to take revenge with your own hands, right?
 I’ll do the same if I were you.
 I am…not like you!
 Haruna…
 Kikunojou, please forgive me.
 Princess Haruna.
 Here, Kikunojou could look over the Land of Green.
 I'm sure that Kikunojou will watch over everyone forever.
 Well, Lady Haruna, we are leaving now.
 Thank you, Naruto, Choji, and Hinata.
 Shizune, I’d like to ask a special favor.
 What is it, Princess Haruna?
 My role is to take over my father’s will to protect the peace of Land of Green.
 In order to do that,
 I want to borrow some help from the Leaf Village.
 Our help?
 Yes.
 I want you to lend me Naruto.
 Huh?!
 Please, Naruto.
 Princess Haruna.
 I want you to help me with the revival of the Land of Green.
 I…I…
 I’m sorry, but I can’t really do that.
 I need to go back to my friends.
 And I need to do more training and become much stronger.
 There are things that I must do.
 It’s all for my precious friends!
 Then I can’t take you away from them…
 Naruto, I’ll promise that I will do my best to keep my father’s wishes
 and strive for a peaceful country where no one will be sacrificed.
 Yeah!
 It’s a promise!
 Thank you! Naruto!
 Good-bye! Everybody!
 We’ll come back someday!
 Bye!
 See ya!
 Yesterday’s Call Sign, was all from my cell phone.
 In a strange park, I play the Fuzz Guitar without enthusiasm.
 Yellow Moon.
 Even now, counting to three, I open my eyes
 Shadow Moon I am still dreaming.
 Look at my eyes, look at my eyes, as we face one another’s back
 Look at my eyes, when can we meet?
 EveryDay EveryNight With every word I can think of
 Right away, my messy feelings as is,
 A magical chord change, in a restless city
 A daily JAZZ Guitar played in a soft minor key
 No! He’s looking over here!
 Of course, he’ll look! Stop complaining and attack him!
 No, no, it’s impossible!
 He just moved right now! He moved, Naruto!
 Of course, he’ll move! Hey, approach him more!
 No, no, no. This is my limit.
 Come on, just give him a one good hit!
 No, the enemy is that thing you know?
 A monster, a monster!
 This wouldn’t be a mission!
 Next time: “Ino Screams! Chubby Paradise!”
","[set(), set(), set(), set(), set(), set(), set(), set(), set(), {'Hinata'}, {'Hinata'}, {'Hinata', 'Janin'}, set(), set(), {'Choji', 'Hinata'}, set(), set(), set(), set(), set(), set(), set(), set(), set(), set(), set(), {'Naruto'}, set(), set(), set(), set(), set(), set(), set(), {'Choji', 'Hinata'}, {'Naruto'}, set(), set(), set(), set(), set(), set(), set(), set(), set(), set(), set(), set(), set(), set(), set(), set(), set(), set(), set(), {'Naruto'}, set(), {'Naruto'}, set(), set(), set(), set(), set(), {'Naruto'}, set(), set(), set(), set(), set(), set(), set(), set(), set(), set(), set(), set(), set(), set(), set(), set(), set(), set(), set(), set(), set(), set(), {'Naruto'}, set(), {'Lens'}, set(), set(), set(), set(), set(), set(), set(), {'Naruto'}, set(), {'Naruto', 'Haruna'}, set(), {'by', 'Jutsu'}, set(), {'Haruna'}, set(), set(), {'Haruna', 'Hinata'}, set(), set(), set(), set(), set(), set(), set(), set(), set(), set(), set(), set(), set(), set(), set(), set(), set(), set(), set(), set(), set(), set(), set(), {'Haruna'}, set(), set(), set(), set(), set(), {'Naruto'}, set(), set(), set(), set(), set(), set(), set(), set(), {'Naruto'}, {'Haruna'}, set(), set(), set(), set(), set(), {'Naruto'}, set(), set(), set(), set(), set(), {'Naruto'}, set(), {'Naruto'}, set(), set(), set(), set(), set(), set(), {'Shikamaru'}, set(), set(), {'Naruto'}, {'Choji'}, {'Hinata'}, {'Yurinojou'}, set(), set(), set(), set(), set(), {'Haruna', 'Tsunade'}, set(), set(), set(), set(), set(), set(), {'Haruna'}, set(), set(), {'Haruna'}, set(), set(), set(), {'Kikunojou', 'Haruna'}, {'Haruna'}, {'Kikunojou'}, {'Kikunojou'}, {'Haruna'}, {'Naruto', 'Choji', 'Hinata'}, {'Shizune'}, {'Haruna'}, set(), set(), set(), set(), set(), set(), {'Naruto'}, {'Haruna'}, set(), set(), set(), set(), set(), set(), {'Naruto'}, set(), set(), set(), {'Naruto'}, set(), set(), set(), set(), set(), set(), set(), set(), {'Shadow'}, set(), set(), set(), set(), set(), set(), set(), {'Naruto'}, set(), set(), set(), set(), set(), set(), set(), set(), set(), {'Paradise'}]"
190,"Rock away your existence,
 Shouting that you are here…
 A new journey begins now.
 As we survived through the changing seasons,
 we gained knowledge and strength, (just looks like a survival game)
 But the forgotten memories,
 of the feelings abandoned within the flows of time,
 have also been lost.
 When sinking down, we learned loneliness.
 But now we’ve met each other, we are no longer alone.
 Unveil your feelings, Those high emotions
 Those tears will change your fate.
 Pound your heartbeat against the darkness,
 We’re sure to meet, Under the same flag of pain
 A coup at the Land of Green…?
 Yes, it seems there’s no mistake.
 The retainers conspired with some men
 and began a rebellion…
 What happened to Naruto and the others?
 Speculating from their gathering point,
 they are around here.
 So they’ve already crossed the border…
 The large countries have agreed to make this
 a demilitarized zone.
 Considering Naruto and the other’s mission,
 they should be in a safe area…
 Are you sure?
 What do you mean…?
 Don’t you think the timing of this request
 strangely overlaps with the coup?
 Then you’re saying that Naruto’s mission is also related to this case?
 There is a possibility…
 But there’s no time to deal with Naruto at the moment.
 We have to take back the Land of Green
 from the rebels as soon as possible.
 If we leave it like this,
 the flames of the war will eventually reach other countries…
 True…
 Shizune, gather the free villagers
 and have them head to the Land of Green immediately!
 Yes, ma'am!
 You’ve done it now!
 What a persistent brat…!
 You shouldn't be able to stand anymore…
 Naruto!
 This is…nothing.
 What a surprise… you got some guts.
 Then, take this too!
 Ninja Art Magnet! Electromagnetic Illusion.
 Naruto!
 It’s useless! Your voice wouldn’t reach him!
 The human brain functions by
 a faint electric current running through it…
 If you receive my magnetic force powder,
 it’s going to alter your electric current and stop your thinking…
 That chain also has a strong magnetic force.
 Now, get buried!
 Naruto!
 Are you okay?
 Thank goodness…
 Hinata…run!
 I can’t leave you behind…
 He is…
 He’s someone that you can’t deal with…
 Naruto… I promise I’ll save you!
 Hinata!
 I’ll have you tell me where that girl is!
 Byakugan!
 Take this! Electromagnetic Illusion!
 Protective 8 Trigrams 64 Palms!
 What?!
 I see, so that is the Byakugan of the Village Hidden in Leaves…
 How interesting!
 What wonderful Taijutsu, but…
 I’ll crush it with my power!
 I did it…?!
 Yeah right… That level of Taijutsu will not work!
 It’s useless!
 This is bad…!
 You’re not much of a challenge. I’m disappointed!
 Now tell me! Where did you hide that girl?
 If you answer me, I’ll let you live… That boy too!
 If you rescue him right now, he wouldn’t die.
 Run…Hinata…
 Now say it!
 You don’t want to save that boy?
 Or do you think you could win against me?
 If I say it… Naruto would never forgive me.
 Then I’ll force you to talk!
 I’ll change the area behind you into a powerful magnet.
 I can change the position of the magnet according to your movement.
 So it's a waste to run away!
 That brat…
 She evaded the attack by throwing a paper bomb at that very instant.
 She’s pretty quick witted.
 But…
 I won’t let you go!
 Hinata…
 Naruto… I promise that I’ll return to rescue you…!
 But, there is a huge difference in power between him and me…
 I could never win against him!
 He’s already caught up to me… What should I do?
 This is…iron sand…?
 I see…his Jutsu can change his body
 and the things he touches into magnet.
 The reason why he didn’t attack back there
 was to brush off the iron sand from his body…
 If he doesn’t, he would sink in his iron sand.
 His attack pattern consists of alternating between
 Ninja Art Magnet and Iron Sand Genjutsu …
 He does this to turn his magnet powers on and off
 so his body won’t completely turn into a magnet.
 Then, there is one way to beat him!
 Now…play time is almost over!
 Now, it’s time you give up!
 I would never give up!
 Because that is my Ninja Way!
 What a waste…
 How dare you do that to Naruto!
 I will definitely not forgive you!
 Once you say where that girl is,
 why don’t you live with that brat in hell!
 Hey, don’t be shy and come closer!
 Right now!
 I’ll risk everything in this single attack!
 An attack that didn’t work before,
 will never work!
 Is…that right?
 What?!
 We're both going to hell!
 Let go, you!
 You brat! How dare you play around with me!
 I changed my mind. I’ll finish you off now!
 What is this?!
 Just now… I struck a Chakra Point
 that would make your Chakra flow go out of control.
 Now your body will just turn into a strong magnet…
 What…? That’s why you brought me to this sandy area?!
 S-Stop!
 I did it…Naruto…
 Damn…! I can’t move!
 The Human Boulder!
 Naruto!
 Choji…!
 Are you okay, Naruto…?
 Thanks…Yurinojou.
 So what happened?
 The second Janin attacked me and I got beaten up.
 What happened to Hinata and the princess?
 Oh yeah…!
 I can’t stay here!
 What…? What’s going on…? Naruto?
 Hinata is in danger!
 –Oh! Naruto! 					–Naruto!
 Hinata!
 Are you okay…Hinata?
 Hang in there, Hinata!
 N-Naruto… Choji…
 Yurinojou…
 You guys… you guys came to rescue me…
 Of course… We’re friends, right?!
 Yes!
 By the way, that magnet guy… Where did he go?
 He probably sunk into the sand…
 What?! You did it, Hinata?
 Yeah… I did my best…
 Hinata, you’re great…
 The guy that I couldn’t handle…
 You’re complimenting me?
 Naruto…
 Here…
 This is…my forehead band?
 The mission is not over yet.
 Naruto, please protect the princess… Princess Haruna.
 Hinata…
 I’ll promise you!
 I swear on this forehead band I will definitely protect the Princess!
 And…
 I can’t be losing against you!
 Naruto…
 Look after Hinata, Choji…Yurinojou!
 Right!
 Leave it to us…Naruto!
 Well, I’ll be darned.
 I can’t believe that Ruiga and Jiga were both defeated.
 Well, that saves some trouble though…
 Nobody has ever escaped from my Jutsu.
 Today will be a good day.
 Haruna! Where are you?!
 There she is!
 Haruna! Get a hold of yourself!
 Are you okay?
 I’m glad…
 I-It’s me, Princess Haruna!
 N-Naruto…
 I came to rescue you,
 but what is this treatment?
 Sorry…
 Why did you escape by yourself?
 I can’t count on you guys…
 I will try to survive no matter who's sacrificed…
 As long as I survive, the Land of Green can be revived.
 That’s the most important thing, right?!
 I am a victim!
 If I declare that other countries will lend me their power.
 If I take back the country and
 I, the true successor, become the feudal lord,
 then people will definitely gather and
 the Land of Green will return to the way it was!
 I don’t think so.
 You’re saying that the Land of Green won’t revive?
 I’m not saying that…
 But I just thought what if I lived in the Land of Green…
 If I was a Ninja just like Yurinojou…
 I won’t guard a feudal lord like you!
 Naruto!
 What do you know?! What do you know about me?!
 What do you know about my life as a hostage?!
 Under watch 24/7,
 not even allowed to have my own free time,
 I was lonely everyday.
 Because of that lifestyle,
 I became sick and was in bed for a long time.
 I was finally able to return home after being close to dying…
 Naruto! If you’re saying that I’m wrong, then answer me!
 Were the things done to me
 in the name of protecting the Land of Green all wrong?!
 Then why did my father and mother send me away as a hostage?!
 Answer me! Naruto!
 I won’t count on you.
 I will go by myself.
 Wait. 					I will go too.
 I promised Hinata that I will definitely protect you, princess!
 With Hinata…?
 She fought with the second Janin
 and got hurt badly....
 Hinata did…?
 You guys said that you didn’t accept the mission of protecting me.
 Then, why do you concern yourselves with me?
 I…
 Not only me, but Hinata and Choji, too.
 We don't like it when somebody before us is hurt or sad… That's all.
 Well, let’s go!
 If we pass through the valley ahead of us,
 we’ll get to the town.
 If we do that, they probably won't chase us all the way there!
 Please be careful…
 No one uses this deer path.
 This should shake them…
 I found you!
 It’s impossible… to run away from me!
 Choji?!
 Don’t make useless efforts…
 I’ll make you guys my hostages!
 You guys take them back to the castle!
 Yes!
 If you wander around me
 you might get caught in my Jutsu and die.
 That’s it… We’re almost there!
 There’s no time to waste! Let’s go!
 Okay!
 Haruna!
 I’m okay!
 Oh no!
 Wh-What is this?!
 I see… You have good sense to dodge that attack!
 Who is it?! 					Where are you?!
 Here, over here!
 Too bad, but you guys won’t be able to reach that village.
 Since you guys are going to die here!
 Yesterday’s Call Sign, was all from my cell phone.
 In a strange park, I play the Fuzz Guitar without enthusiasm.
 Yellow Moon.
 Even now, counting to three, I open my eyes
 Shadow Moon I am still dreaming.
 Look at my eyes, look at my eyes, as we face one another’s back
 Look at my eyes, when can we meet?
 EveryDay EveryNight With every word I can think of
 Right away, my messy feelings as is,
 A magical chord change, in a restless city
 A daily JAZZ Guitar played in a soft minor key
 Damn! He is so troublesome!
 How dare he use many showy attacks.
 There is no way I can retaliate!
 I've gotta do something.
 At this rate, I’m gonna get cornered and shot.
 But even if I wanted to hide, Haruna’s legs are…
 Oh, damn it!
 What in the world should I do?!
 Next time: “Forecast: Death! Cloudy with Chance of Sun!”
","[set(), set(), set(), set(), set(), set(), set(), {'Naruto'}, set(), set(), {'Naruto'}, set(), set(), {'Naruto'}, {'Naruto'}, set(), {'Shizune'}, set(), set(), set(), {'Naruto'}, set(), set(), set(), set(), set(), {'Naruto'}, set(), set(), set(), set(), {'Naruto'}, set(), {'Hinata'}, {'Naruto'}, {'Hinata'}, set(), {'Byakugan'}, set(), set(), set(), set(), {'Byakugan'}, set(), set(), set(), set(), set(), set(), set(), set(), set(), set(), set(), {'Hinata'}, set(), set(), {'Naruto'}, set(), set(), set(), set(), set(), set(), set(), {'Naruto', 'Hinata'}, set(), set(), set(), set(), set(), set(), set(), set(), set(), set(), set(), {'Naruto'}, set(), set(), set(), set(), set(), set(), set(), set(), set(), set(), set(), set(), set(), set(), set(), set(), set(), set(), set(), {'Naruto'}, set(), {'The'}, {'Naruto'}, {'Choji'}, {'Naruto'}, {'Yurinojou'}, set(), {'Janin'}, {'Hinata'}, set(), set(), set(), set(), {'Naruto'}, {'Hinata'}, set(), {'Naruto'}, {'Naruto'}, {'Hinata'}, {'Hinata'}, {'Hinata'}, {'Naruto', 'Choji', 'Yurinojou'}, set(), set(), set(), {'Hinata'}, {'Hinata'}, {'Naruto'}, set(), {'Naruto', 'Haruna'}, {'Hinata'}, set(), set(), {'Naruto', 'Choji', 'Yurinojou', 'Hinata'}, set(), {'Naruto'}, set(), {'Jiga', 'Ruiga'}, set(), set(), set(), set(), set(), set(), set(), set(), {'Haruna'}, set(), set(), set(), set(), set(), set(), set(), set(), set(), {'Yurinojou'}, {'Naruto'}, set(), set(), set(), set(), set(), {'Naruto'}, set(), set(), set(), set(), {'Naruto'}, set(), set(), set(), set(), {'Hinata'}, {'Hinata'}, {'and', 'Hinata', 'Janin'}, set(), set(), {'Choji', 'Hinata'}, set(), set(), set(), set(), set(), set(), set(), {'Choji'}, set(), set(), set(), set(), set(), set(), set(), set(), set(), set(), set(), set(), set(), set(), set(), set(), set(), set(), set(), set(), set(), {'Shadow'}, set(), set(), set(), set(), set(), set(), set(), {'Haruna'}, set(), set(), set()]"
